{
  "recipe_id": "qwen3-coder",
  "recipe_version": "0.2.0",
  "content_hash": "sha256:10a6b27c4692fecfb31f72d60c82872b956495e783491d5b8f1afaf5e79d2585",
  "run_id": "20260907T113818Z-606aff40",
  "contributor_id": "pilot-itzco",
  "quant": "UD-Q4_K_XL",
  "probe_output": {
    "schema_version": 2,
    "timestamp": "2026-09-07T11:38:18Z",
    "family": "arch",
    "distro": "CachyOS",
    "kernel": "7.0.11-3-cachyos-px13 (linux-cachyos 7.2.3-1)",
    "mem": {
      "total_gb": 124.9,
      "gtt_gib": 110.0,
      "vram_mib": 512.0
    },
    "gpu": {
      "name": "AMD Radeon 8060S Graphics",
      "driver": "radv",
      "vulkan_version": "1.4.357",
      "free_mib": 111303.0
    },
    "backend": {
      "version_string": "version: 0.4.0-dev (build 10809, commit 5266f24da7)",
      "build": "10809",
      "commit": "5266f24da7",
      "binary": "/usr/bin/llama-server",
      "install_method": "distro-package",
      "pkg_version": "0.4.0-1.1"
    },
    "rocm_version": null,
    "llama_swap_config": "/home/itzco/.config/llama-swap/config.yaml",
    "raw_hash": "sha256:398a76e3c34c1a20c4cdf6a31c8f7e92042c18a8067a9584a7e11276b67c9bc0"
  },
  "tests": [
    {
      "id": "throughput",
      "result": "pass",
      "metrics": {
        "tokens_per_sec_tg": 66.9,
        "median_round_s": 0.82,
        "tokens_per_sec_pp": 6728.7
      },
      "observations": [
        "3 rounds x ~64 out-tokens",
        "prompt-eval round: ~704 tokens"
      ]
    },
    {
      "id": "tool-roundtrip",
      "result": "pass",
      "metrics": {
        "tool_calls": 1,
        "latency_s": 0.73
      },
      "observations": [
        "1/1 tool call(s) well-formed"
      ]
    }
  ],
  "metrics": {},
  "notes": "-ub 2048; PP delta vs baseline reported in commit message; source post reddit 1w82ztz",
  "tool_version": "submit_result.py@2.0.0"
}
