{
  "recipe_id": "qwen3.8-flash-next",
  "recipe_version": "0.2.0",
  "content_hash": "sha256:e992773347c4dd2ec8bf7873918bfb460ddfc39d979af8c706271644068d82b8",
  "run_id": "20260907T153604Z-58c0cc83",
  "contributor_id": "nathan-fork-pilot",
  "quant": "UD-IQ4_XS",
  "probe_output": {
    "schema_version": 2,
    "timestamp": "2026-09-07T15:36:04Z",
    "family": "arch",
    "distro": "CachyOS",
    "kernel": "7.0.11-3-cachyos-px13 (linux-cachyos 7.2.3-1)",
    "mem": {
      "total_gb": 124.9,
      "gtt_gib": 110.0,
      "vram_mib": 512.0
    },
    "gpu": {
      "name": "AMD Radeon 8060S Graphics",
      "driver": "radv",
      "vulkan_version": "1.4.357",
      "free_mib": 39112.0
    },
    "backend": {
      "version_string": "version: 0.4.0-dev (build 10809, commit 5266f24da7)",
      "build": "10809",
      "commit": "5266f24da7",
      "binary": "/usr/bin/llama-server",
      "install_method": "distro-package",
      "pkg_version": "0.4.0-1.1"
    },
    "rocm_version": null,
    "llama_swap_config": "/home/itzco/.config/llama-swap/config.yaml",
    "raw_hash": "sha256:74af4eaac2469454bcf2c2eacc25c71783fd031f856faf32204d5469c3d48f30"
  },
  "tests": [
    {
      "id": "tool-roundtrip",
      "result": "pass",
      "metrics": {
        "tool_calls": 1,
        "latency_s": 3.05
      },
      "observations": [
        "1/1 tool call(s) well-formed"
      ]
    },
    {
      "id": "agent-coding",
      "result": "pass",
      "metrics": {
        "rounds": 3,
        "tool_calls": 3,
        "fixed": true
      },
      "observations": [
        "final reply (round 3): DONE",
        "ground truth: main.py prints '5' (want '5')"
      ]
    },
    {
      "id": "throughput",
      "result": "pass",
      "metrics": {
        "tokens_per_sec_tg": 18.0,
        "median_round_s": 30.36,
        "tokens_per_sec_pp": 1798.1
      },
      "observations": [
        "2 rounds x ~64 out-tokens",
        "prompt-eval round: ~10945 tokens"
      ]
    },
    {
      "id": "context-recall",
      "result": "pass",
      "metrics": {
        "latency_s": 19.02,
        "retrieved": true,
        "context_tokens": 4096
      },
      "observations": [
        "approx 4096 token context, needle at ~50%",
        "answer: STRIX42"
      ]
    }
  ],
  "metrics": {},
  "notes": "Nathan strix-halo-vulkan fork commit 5d8c07b44 built from source (GGML_VULKAN, host Mesa radv) + agentionai MTP Q8_0 sidecar fixed n4, port 8098. Fork=prefill, MTP=decode (attribution separate). COLD PP @10947 tok server-eval: 383.8 t/s vs v0.1.0 mainline 320 t/s (+20%, fork FA dequant-once + mmid rowlists). Server-eval decode on battery traffic (temp 0, structured/code/tool 64-tok rounds): 29.1-44.0 t/s per request, mean ~35 t/s (>=50-tok lines), vs v0.1.0 19.4-22.9 t/s -> ~1.6-1.8x (MTP). MTP acceptance content-dependent: structured 0.73-1.00 (deterministic count-gen 52.1 t/s at acc 1.0); open-ended prose 0.39-0.55 -> ~18-25 t/s (draft-head greedy agreement collapses on flat creative distributions; receipts' 40 t/s headline was code-emission traffic, their reasoning-heavy band 24-31). Runner metrics: tg 18.0 t/s mean (contaminated by one cold 10947-tok PP round at 30.4s, same artifact as v0.1.0's 10.6/37.4s); runner tokens_per_sec_pp 1798.1 is prefix-cache artifact (warm sys prompt), NOT cold PP. agent-coding pass 3 rounds (v0.1.0: 4), tool-roundtrip pass latency 3.05s (v0.1.0 4.75s), context-recall pass STRIX42@4096. Identity sane (Qwen/Tongyi, no leak). Probe backend block reflects the untouched distro /usr/bin/llama-server b10809 (machine reference); the recipe backend pins the fork. Full server log: /tmp/mtp.log; per-request parse: /tmp/mtp-server-timing.json; sanity: /tmp/mtp-sanity.json.",
  "tool_version": "submit_result.py@2.0.0"
}
