{
  "recipe_id": "qwen3-coder",
  "recipe_version": "0.2.1",
  "content_hash": "sha256:10a6b27c4692fecfb31f72d60c82872b956495e783491d5b8f1afaf5e79d2585",
  "run_id": "20260907T121730Z-64aa0e84",
  "contributor_id": "itzco",
  "quant": "UD-Q4_K_XL",
  "probe_output": {
    "schema_version": 2,
    "timestamp": "2026-09-07T12:17:30Z",
    "family": "arch",
    "distro": "CachyOS",
    "kernel": "7.0.11-3-cachyos-px13 (linux-cachyos 7.2.3-1)",
    "mem": {
      "total_gb": 124.9,
      "gtt_gib": 110.0,
      "vram_mib": 512.0
    },
    "gpu": {
      "name": "AMD Radeon 8060S Graphics",
      "driver": "radv",
      "vulkan_version": "1.4.357",
      "free_mib": 20449.0
    },
    "backend": {
      "version_string": "version: 0.4.0-dev (build 10809, commit 5266f24da7)",
      "build": "10809",
      "commit": "5266f24da7",
      "binary": "/usr/bin/llama-server",
      "install_method": "distro-package",
      "pkg_version": "0.4.0-1.1"
    },
    "rocm_version": null,
    "llama_swap_config": "/home/itzco/.config/llama-swap/config.yaml",
    "raw_hash": "sha256:56386e6463e5a7c1d228a15198a82797cb13473e5e3cff2ec38fa8df41cb08e0"
  },
  "tests": [
    {
      "id": "agent-coding",
      "result": "pass",
      "metrics": {
        "rounds": 7,
        "tool_calls": 6,
        "fixed": true
      },
      "observations": [
        "final reply (round 7): DONE",
        "ground truth: main.py prints '5' (want '5')"
      ]
    }
  ],
  "metrics": {},
  "notes": "agent-coding: multi-round file edit + run loop; sandbox bug fixed, ground truth verified (main.py -> 5)",
  "tool_version": "submit_result.py@2.0.0"
}
