{
  "recipe_id": "qwen3.8-27b",
  "recipe_version": "0.1.0",
  "content_hash": "sha256:9a8be2430a2451c519b0a2fb5993d85bdd22be771d1924f037ba713211b056c3",
  "run_id": "20260907T101808Z-7a56d591",
  "contributor_id": "itzco",
  "quant": "Q8_0",
  "probe_output": {
    "schema_version": 2,
    "timestamp": "2026-09-07T10:18:08Z",
    "family": "arch",
    "distro": "CachyOS",
    "kernel": "7.0.11-3-cachyos-px13 (linux-cachyos 7.2.3-1)",
    "mem": {
      "total_gb": 124.9,
      "gtt_gib": 110.0,
      "vram_mib": 512.0
    },
    "gpu": {
      "name": "AMD Radeon 8060S Graphics",
      "driver": "radv",
      "vulkan_version": "1.4.357",
      "free_mib": 49728.0
    },
    "backend": {
      "version_string": "version: 0.4.0-dev (build 10809, commit 5266f24da7)",
      "build": "10809",
      "commit": "5266f24da7"
    },
    "rocm_version": null,
    "llama_swap_config": "/home/itzco/.config/llama-swap/config.yaml",
    "raw_hash": "sha256:7493899c443fde06aee579b3df5c8364deea7be35db9ed3e51aadec7dc9e3703"
  },
  "tests": [
    {
      "id": "tool-roundtrip",
      "result": "pass",
      "metrics": {
        "tool_calls": 1,
        "latency_s": 9.15
      },
      "observations": [
        "1/1 tool call(s) well-formed"
      ]
    },
    {
      "id": "throughput",
      "result": "pass",
      "metrics": {
        "tokens_per_sec_tg": 7.3,
        "median_round_s": 12.97
      },
      "observations": [
        "3 rounds x ~96 out-tokens"
      ]
    },
    {
      "id": "context-recall",
      "result": "pass",
      "metrics": {
        "latency_s": 43.11,
        "retrieved": true,
        "context_tokens": 4096
      },
      "observations": [
        "approx 4096 token context, needle at ~50%",
        "answer: STRIX42"
      ]
    },
    {
      "id": "vision-basic",
      "result": "unsupported",
      "observations": [
        "server/model rejected image input (no mmproj or non-multimodal model)"
      ],
      "detail": "HTTP Error 500: Internal Server Error"
    }
  ],
  "metrics": {},
  "notes": "CachyOS box; direct llama-server (no llama-swap); ctx 32k; tool+context+throughput pass, vision unsupported (no mmproj in this deployment)",
  "tool_version": "submit_result.py@2.0.0"
}
