{
  "recipe_id": "qwen3-coder",
  "recipe_version": "0.2.0",
  "content_hash": "sha256:10a6b27c4692fecfb31f72d60c82872b956495e783491d5b8f1afaf5e79d2585",
  "run_id": "20260907T115825Z-95cb6c77",
  "contributor_id": "itzco",
  "quant": "UD-Q4_K_XL",
  "probe_output": {
    "schema_version": 2,
    "timestamp": "2026-09-07T11:58:25Z",
    "family": "arch",
    "distro": "CachyOS",
    "kernel": "7.0.11-3-cachyos-px13 (linux-cachyos 7.2.3-1)",
    "mem": {
      "total_gb": 124.9,
      "gtt_gib": 110.0,
      "vram_mib": 512.0
    },
    "gpu": {
      "name": "AMD Radeon 8060S Graphics",
      "driver": "radv",
      "vulkan_version": "1.4.357",
      "free_mib": 20474.0
    },
    "backend": {
      "version_string": "version: 0.4.0-dev (build 10809, commit 5266f24da7)",
      "build": "10809",
      "commit": "5266f24da7",
      "binary": "/usr/bin/llama-server",
      "install_method": "distro-package",
      "pkg_version": "0.4.0-1.1"
    },
    "rocm_version": null,
    "llama_swap_config": "/home/itzco/.config/llama-swap/config.yaml",
    "raw_hash": "sha256:d2cbe043255dee462de8876a816a66e9ce2b1394070b1e5f56ffcd820e2f10c3"
  },
  "tests": [
    {
      "id": "throughput",
      "result": "pass",
      "metrics": {
        "tokens_per_sec_tg": 49.3,
        "median_round_s": 0.7,
        "tokens_per_sec_pp": 75317.8
      },
      "observations": [
        "2 rounds x ~32 out-tokens",
        "prompt-eval round: ~10944 tokens"
      ]
    }
  ],
  "metrics": {},
  "notes": "long-context follow-up (11k tokens PP): -ub 2048 shows no PP gain over default on Vulkan/radv (fork kernels are ROCm-targeted)",
  "tool_version": "submit_result.py@2.0.0"
}
