{
  "recipe_id": "qwen3.8-flash-next-uncensored-halogen",
  "recipe_version": "0.3.0",
  "content_hash": "sha256:4f172fc875d2b133b37f0a86850ddb0d935df5511d371562d43898f5d98d8afc",
  "run_id": "20261003T160028Z-5cebc597",
  "contributor_id": "mritzco",
  "quant": "IQ4_XS",
  "probe_output": {
    "schema_version": 2,
    "timestamp": "2026-10-03T16:00:28Z",
    "family": "arch",
    "distro": "CachyOS",
    "kernel": "7.2.3-1-cachyos (linux-cachyos 7.2.3-1)",
    "mem": {
      "total_gb": 124.9,
      "gtt_gib": 110.0,
      "vram_mib": 512.0
    },
    "gpu": {
      "name": "AMD Radeon 8060S Graphics",
      "driver": "radv",
      "vulkan_version": "1.4.357",
      "free_mib": 91225.0
    },
    "backend": {
      "version_string": "version: 0.4.0-dev (build 10809, commit 5266f24da7)",
      "build": "10809",
      "commit": "5266f24da7",
      "binary": "/usr/bin/llama-server",
      "install_method": "distro-package",
      "pkg_version": "0.4.0-1.1"
    },
    "rocm_version": null,
    "llama_swap_config": "/home/itzco/.config/llama-swap/config.yaml",
    "raw_hash": "sha256:466a1c233b2d74899607eb447af100ac078bbed5d35e0471fef3991bf7b4bb0d"
  },
  "tests": [
    {
      "id": "tool-roundtrip",
      "result": "pass",
      "metrics": {
        "tool_calls": 1,
        "latency_s": 3.17
      },
      "observations": [
        "1/1 tool call(s) well-formed"
      ]
    },
    {
      "id": "throughput",
      "result": "pass",
      "metrics": {
        "tokens_per_sec_tg": 9.0,
        "median_round_s": 28.47,
        "tokens_per_sec_pp": 4128.8
      },
      "observations": [
        "2 rounds x ~64 out-tokens",
        "prompt-eval round: ~10983 tokens"
      ]
    }
  ],
  "metrics": {},
  "notes": "v0.3.0 = v0.2.0 + the NPU: --device /dev/accel/accel0, the host XRT mounts, and HALOGEN_NPU_MODELS (decider-0.8b, qwen3-embedding-0.6b, qwen3-reranker-0.6b, qwen3guard-gen-0.6b, qwen3.5-2b). NPU endpoints verified separately: embeddings 1024-dim unit-norm at 7465 tok/s on an 8-text batch; rerank ordering sane; moderation Safe/Unsafe 0.998; decider-0.8b 0.08 s; qwen3.5-2b 0.91 s. GPU+NPU concurrency: Flash decode 38.4 -> 33.5 t/s with 29 NPU batches in parallel, no errors, no hang. tokens_per_sec_pp is cache-inflated; see the v0.1.0 cache-off record.",
  "tool_version": "submit_result.py@2.0.0"
}
