{
  "recipe_id": "qwen3.8-flash-next-131k",
  "recipe_version": "0.1.0",
  "content_hash": "sha256:0b714b6ae6212b6e0b4435c167c0152b6fbb87dfff0e59a6497f9e0918b5abe9",
  "run_id": "20260908T110801Z-06097239",
  "contributor_id": "flash-pilot",
  "quant": "IQ4_XS",
  "probe_output": {
    "schema_version": 2,
    "timestamp": "2026-09-08T11:08:01Z",
    "family": "arch",
    "distro": "CachyOS",
    "kernel": "7.0.11-3-cachyos-px13 (linux-cachyos 7.2.3-1)",
    "mem": {
      "total_gb": 124.9,
      "gtt_gib": 110.0,
      "vram_mib": 512.0
    },
    "gpu": {
      "name": "AMD Radeon 8060S Graphics",
      "driver": "radv",
      "vulkan_version": "1.4.357",
      "free_mib": 82241.0
    },
    "backend": {
      "version_string": "version: 0.4.0-dev (build 10809, commit 5266f24da7)",
      "build": "10809",
      "commit": "5266f24da7",
      "binary": "/usr/bin/llama-server",
      "install_method": "distro-package",
      "pkg_version": "0.4.0-1.1"
    },
    "rocm_version": null,
    "llama_swap_config": "/home/itzco/.config/llama-swap/config.yaml",
    "raw_hash": "sha256:361db999fbb7a7424e22c99659ea9dd76ddaa038a2bae2933adc241940ca2d12"
  },
  "tests": [
    {
      "id": "tool-roundtrip",
      "result": "pass",
      "metrics": {
        "tool_calls": 1,
        "latency_s": 4.63
      },
      "observations": [
        "1/1 tool call(s) well-formed"
      ]
    },
    {
      "id": "throughput",
      "result": "pass",
      "metrics": {
        "tokens_per_sec_tg": 11.0,
        "median_round_s": 37.13,
        "tokens_per_sec_pp": 1290.5
      },
      "observations": [
        "2 rounds x ~64 out-tokens",
        "prompt-eval round: ~10945 tokens"
      ]
    },
    {
      "id": "agent-coding",
      "result": "pass",
      "metrics": {
        "rounds": 4,
        "tool_calls": 4,
        "fixed": true
      },
      "observations": [
        "final reply (round 4): DONE",
        "ground truth: main.py prints '5' (want '5')"
      ]
    },
    {
      "id": "context-recall",
      "result": "pass",
      "metrics": {
        "latency_s": 53.78,
        "retrieved": true,
        "context_tokens": 8192
      },
      "observations": [
        "approx 8192 token context, needle at ~50%",
        "answer: STRIX42"
      ]
    }
  ],
  "metrics": {},
  "notes": "131k ctx variant, cold load ~25s. Runner TG 11.0 contaminated by cold 11k-token PP round (known artifact); llama-swap UI field stats from real omp session at 30-51k ctx: decode 14.6-18.4 t/s sustained. context-recall @8k pass.",
  "tool_version": "submit_result.py@2.0.0"
}
