{
  "recipe_id": "qwen3-coder",
  "recipe_version": "0.1.0",
  "content_hash": "sha256:8b452dd97af8d7f1dffca91d73dfde85644fd45bcf0fd2d7f93e831d4a547747",
  "run_id": "20260907T115824Z-1a9cd9cc",
  "contributor_id": "itzco",
  "quant": "UD-Q4_K_XL",
  "probe_output": {
    "schema_version": 2,
    "timestamp": "2026-09-07T11:58:24Z",
    "family": "arch",
    "distro": "CachyOS",
    "kernel": "7.0.11-3-cachyos-px13 (linux-cachyos 7.2.3-1)",
    "mem": {
      "total_gb": 124.9,
      "gtt_gib": 110.0,
      "vram_mib": 512.0
    },
    "gpu": {
      "name": "AMD Radeon 8060S Graphics",
      "driver": "radv",
      "vulkan_version": "1.4.357",
      "free_mib": 20475.0
    },
    "backend": {
      "version_string": "version: 0.4.0-dev (build 10809, commit 5266f24da7)",
      "build": "10809",
      "commit": "5266f24da7",
      "binary": "/usr/bin/llama-server",
      "install_method": "distro-package",
      "pkg_version": "0.4.0-1.1"
    },
    "rocm_version": null,
    "llama_swap_config": "/home/itzco/.config/llama-swap/config.yaml",
    "raw_hash": "sha256:0b12c5eb71a9d7bac0779b8a5a749920523d90c79feda2a9a23f8933f970de55"
  },
  "tests": [
    {
      "id": "throughput",
      "result": "pass",
      "metrics": {
        "tokens_per_sec_tg": 49.3,
        "median_round_s": 0.71,
        "tokens_per_sec_pp": 74791.3
      },
      "observations": [
        "2 rounds x ~32 out-tokens",
        "prompt-eval round: ~10944 tokens"
      ]
    }
  ],
  "metrics": {},
  "notes": "long-context follow-up (11k tokens PP): default ubatch; matches -ub 2048 within noise on Vulkan",
  "tool_version": "submit_result.py@2.0.0"
}
