{
  "recipe_id": "qwen3.8-flash-next",
  "recipe_version": "0.1.0",
  "content_hash": "sha256:5ad6730ad596da3c9ebe28040f17c3216f6a714fca748de75537cc2dc29ab5cb",
  "run_id": "20260907T145347Z-f861271b",
  "contributor_id": "flash-pilot",
  "quant": "UD-IQ4_XS",
  "probe_output": {
    "schema_version": 2,
    "timestamp": "2026-09-07T14:53:47Z",
    "family": "arch",
    "distro": "CachyOS",
    "kernel": "7.0.11-3-cachyos-px13 (linux-cachyos 7.2.3-1)",
    "mem": {
      "total_gb": 124.9,
      "gtt_gib": 110.0,
      "vram_mib": 512.0
    },
    "gpu": {
      "name": "AMD Radeon 8060S Graphics",
      "driver": "radv",
      "vulkan_version": "1.4.357",
      "free_mib": 46427.0
    },
    "backend": {
      "version_string": "version: 0.4.0-dev (build 10809, commit 5266f24da7)",
      "build": "10809",
      "commit": "5266f24da7",
      "binary": "/usr/bin/llama-server",
      "install_method": "distro-package",
      "pkg_version": "0.4.0-1.1"
    },
    "rocm_version": null,
    "llama_swap_config": "/home/itzco/.config/llama-swap/config.yaml",
    "raw_hash": "sha256:a8cd5533677d1bc6236e796663dd992b59a5575bf019fc642d031ad2ad6601ad"
  },
  "tests": [
    {
      "id": "tool-roundtrip",
      "result": "pass",
      "metrics": {
        "tool_calls": 1,
        "latency_s": 4.75
      },
      "observations": [
        "1/1 tool call(s) well-formed"
      ]
    },
    {
      "id": "agent-coding",
      "result": "pass",
      "metrics": {
        "rounds": 4,
        "tool_calls": 4,
        "fixed": true
      },
      "observations": [
        "final reply (round 4): DONE",
        "ground truth: main.py prints '5' (want '5')"
      ]
    },
    {
      "id": "throughput",
      "result": "pass",
      "metrics": {
        "tokens_per_sec_tg": 10.6,
        "median_round_s": 37.41,
        "tokens_per_sec_pp": 1468.8
      },
      "observations": [
        "2 rounds x ~64 out-tokens",
        "prompt-eval round: ~10945 tokens"
      ]
    },
    {
      "id": "context-recall",
      "result": "pass",
      "metrics": {
        "latency_s": 24.87,
        "retrieved": true,
        "context_tokens": 4096
      },
      "observations": [
        "approx 4096 token context, needle at ~50%",
        "answer: STRIX42"
      ]
    }
  ],
  "metrics": {},
  "notes": "mainline llama.cpp b10809 Vulkan distro pkg (commit 5266f24da7) UD-IQ4_XS 87.25GB @ HF rev 38bb39ee; NO MTP sidecar, NO Nathan fork. Receipt headline 40 t/s decode was fork+MTP; this run: server-side steady decode ~20-22 t/s (llama-server eval timing), runner TG mean 10.6 t/s contaminated by one cold-PP round (37.4s); cold prompt eval 10947 tok = 320 t/s (llama-server timing); runner tokens_per_sec_pp=1468.8 is a prefix-cache artifact (identical sys prompt warmed in slot; not cold PP). Reasoning flags active (effort medium, budget 2048): at 64-token cap completions burn on reasoning (finish=length) \u2014 reasoning-flag effect on short outputs; agent sessions with content budget unaffected. Compare honestly vs reddit 1w6cf5t fork numbers.",
  "tool_version": "submit_result.py@2.0.0"
}
