{
  "recipe_id": "qwen3.8-flash-next-uncensored",
  "recipe_version": "0.1.0",
  "content_hash": "sha256:d81ceedc837f54af5e47fb84a0ed81308f59d181106e44a640f0620b1dfddb4a",
  "run_id": "20260908T170359Z-7de7a95d",
  "contributor_id": "myhacsint-pilot",
  "quant": "IQ4_XS",
  "probe_output": {
    "schema_version": 2,
    "timestamp": "2026-09-08T17:03:59Z",
    "family": "arch",
    "distro": "CachyOS",
    "kernel": "7.0.11-3-cachyos-px13 (linux-cachyos 7.2.3-1)",
    "mem": {
      "total_gb": 124.9,
      "gtt_gib": 110.0,
      "vram_mib": 512.0
    },
    "gpu": {
      "name": "AMD Radeon 8060S Graphics",
      "driver": "radv",
      "vulkan_version": "1.4.357",
      "free_mib": 111311.0
    },
    "backend": {
      "version_string": "version: 0.4.0-dev (build 10809, commit 5266f24da7)",
      "build": "10809",
      "commit": "5266f24da7",
      "binary": "/usr/bin/llama-server",
      "install_method": "distro-package",
      "pkg_version": "0.4.0-1.1"
    },
    "rocm_version": null,
    "llama_swap_config": "/home/itzco/.config/llama-swap/config.yaml",
    "raw_hash": "sha256:e3b9a7e4be737db98e646ba18d8b2aaeb0d543f071e99948e0a10d4155f64156"
  },
  "tests": [
    {
      "id": "tool-roundtrip",
      "result": "pass",
      "metrics": {
        "tool_calls": 1,
        "latency_s": 3.56
      },
      "observations": [
        "1/1 tool call(s) well-formed"
      ]
    },
    {
      "id": "throughput",
      "result": "pass",
      "metrics": {
        "tokens_per_sec_tg": 19.0,
        "median_round_s": 29.64,
        "tokens_per_sec_pp": 3329.3
      },
      "observations": [
        "2 rounds x ~64 out-tokens",
        "prompt-eval round: ~10983 tokens"
      ]
    },
    {
      "id": "agent-coding",
      "result": "pass",
      "metrics": {
        "rounds": 4,
        "tool_calls": 4,
        "fixed": true
      },
      "observations": [
        "final reply (round 4): DONE",
        "ground truth: main.py prints '5' (want '5')"
      ]
    },
    {
      "id": "context-recall",
      "result": "pass",
      "metrics": {
        "latency_s": 35.24,
        "retrieved": true,
        "context_tokens": 8192
      },
      "observations": [
        "approx 8192 token context, needle at ~50%",
        "answer: STRIX42"
      ]
    }
  ],
  "metrics": {},
  "notes": "myhacsint fork b10685-source @ 2dff8596 (build-vulkan, Vulkan/radv) + mradermacher IQ4_XS uncensored (98.42GB, rev 61f739cd47b2; orca Q5_K_M 134.11GB unrunnable on 128GB \u2014 see recipe annotations) + unsloth shared MTP Q8_0 head (rev 38bb39ee, 2,786,568,256 B) + mmproj-f16. ctx 131072, f16 KV, adaptive spec n0-5 p0.75, --fit on, mmap/lazy/no-repack/no-host, reasoning xhigh+preserve, temp 0 battery. Source: https://www.reddit.com/r/StrixHalo/comments/1w9sye5/ + https://github.com/myhacsint/llama.cpp. Server-eval: decode 30.8-43.9 t/s (short structured/agent rounds), cold PP 398.1 t/s @10985 & 372.9 @12365; MTP acceptance 0.816-1.000/task, mean 0.947. Runner TG 19.0 contaminated by cold-PP round (known artifact). Memory: peak used 87/124.9GB, GTT 78.6GiB, VmHWM 51.5GB; ctx ceiling 131072 (262144 impossible: +12GiB KV over peak; arithmetic in annotations). A/B: vs mainline-131k field decode 14.6-18.4 @30-51k ctx ~2x; in v0.2.0 Nathan+MTP band (29.1-44.0) at 4x ctx with f16 KV; PP 398 vs 383.8 (Nathan) vs 320 (mainline). No MTP leak at temp 0 (clean code/identities); temp>0 caveat recorded.",
  "tool_version": "submit_result.py@2.0.0"
}
