{
  "recipe_id": "qwen3.8-flash-next-uncensored-halogen",
  "recipe_version": "0.1.0",
  "content_hash": "sha256:ae1aef67e0050e867724f87fda68b8e1d848100e58c48f369c3084bca968b00b",
  "run_id": "20261003T140930Z-e49c66d7",
  "contributor_id": "mritzco",
  "quant": "IQ4_XS",
  "probe_output": {
    "schema_version": 2,
    "timestamp": "2026-10-03T14:09:30Z",
    "family": "arch",
    "distro": "CachyOS",
    "kernel": "7.2.3-1-cachyos (linux-cachyos 7.2.3-1)",
    "mem": {
      "total_gb": 124.9,
      "gtt_gib": 110.0,
      "vram_mib": 512.0
    },
    "gpu": {
      "name": "AMD Radeon 8060S Graphics",
      "driver": "radv",
      "vulkan_version": "1.4.357",
      "free_mib": 90251.0
    },
    "backend": {
      "version_string": "version: 0.4.0-dev (build 10809, commit 5266f24da7)",
      "build": "10809",
      "commit": "5266f24da7",
      "binary": "/usr/bin/llama-server",
      "install_method": "distro-package",
      "pkg_version": "0.4.0-1.1"
    },
    "rocm_version": null,
    "llama_swap_config": "/home/itzco/.config/llama-swap/config.yaml",
    "raw_hash": "sha256:d178480b0e779c41d044181addf34d60e1ffcf3fbacb6b927ed985c5555215f2"
  },
  "tests": [
    {
      "id": "tool-roundtrip",
      "result": "pass",
      "metrics": {
        "tool_calls": 1,
        "latency_s": 2.46
      },
      "observations": [
        "1/1 tool call(s) well-formed"
      ]
    },
    {
      "id": "throughput",
      "result": "pass",
      "metrics": {
        "tokens_per_sec_tg": 5.6,
        "median_round_s": 11.45,
        "tokens_per_sec_pp": 976.6
      },
      "observations": [
        "2 rounds x ~64 out-tokens",
        "prompt-eval round: ~10983 tokens"
      ]
    }
  ],
  "metrics": {},
  "notes": "SECOND RUN, supersedes the cache artifact in the previous record: started with HALOGEN_PROMPT_CACHE=0 so the prompt-eval round cannot be served from a warm prefix cache. In the cache-on run the runner's tokens_per_sec_pp read 9514.6 t/s (full prompt_tokens / resume time) while the engine's own timings.prompt_per_second was 1092 t/s for the same cold work - the throughput runner divides TOTAL prompt tokens by wall time, so any prefix cache inflates it. Engine-reported cold prefill at ctx 131072: 1314 t/s @6.7k, 1092 t/s @26.7k tokens. Decode from engine timings: 28.4 t/s thinking-off (91.7% draft acceptance), 33.3 t/s over a 1304-token thinking turn.",
  "tool_version": "submit_result.py@2.0.0"
}
